{
  "protocol": "coworld-improvement-v1",
  "case_id": "4c10da113ad94461054f7c391fad097ca7f6c0a21b603b7cc93d03ec5199da9d",
  "corpus_sha256": "8b7151e61d99082ba22c39ee5dc56e798e339e44387af5834f6b3c1982dfbb3c",
  "worker_sha256": "b125d632e9a93b375f095e1bd1e5bc31df996f9615d87bdb803adf411d75d9a9",
  "checker_sha256": "b125d632e9a93b375f095e1bd1e5bc31df996f9615d87bdb803adf411d75d9a9",
  "evidence_sha256": [
    "8d9aa2479ae00c4f2d91707d4e474d2bf961e92e1706e3ef75f99fac60850f4f",
    "8d9aa2479ae00c4f2d91707d4e474d2bf961e92e1706e3ef75f99fac60850f4f"
  ],
  "repeatability": "verified",
  "result": {
    "kind": "satisfied"
  }
}
