{
  "protocol": "coworld-improvement-v1",
  "case_id": "7f9527c7d6ff1ac3b478c581100180cc844973ed9f61bdd3a305daf8d7244c8b",
  "corpus_sha256": "8b7151e61d99082ba22c39ee5dc56e798e339e44387af5834f6b3c1982dfbb3c",
  "worker_sha256": "e4e8cb9d6024592745a0da533bcd86001c8115184a1ddcf0163c1f3f04494d98",
  "checker_sha256": "f9faf4b72b5f3df0342290a0ee30ac3207c799c6032ec2679090fc37bc656dd1",
  "evidence_sha256": [
    "f445f1f13ec3bf7b0449aff095b1d28e2069505d6c1a107d0168f6a0c6f3adb9",
    "f445f1f13ec3bf7b0449aff095b1d28e2069505d6c1a107d0168f6a0c6f3adb9"
  ],
  "repeatability": "verified",
  "result": {
    "kind": "satisfied"
  }
}
