{
  "protocol": "coworld-improvement-v1",
  "case_id": "01edd604679d89888ad9bb3bd13ca1c531fbbdd1c65f98341e7ce2a5a57d09aa",
  "corpus_sha256": "8b7151e61d99082ba22c39ee5dc56e798e339e44387af5834f6b3c1982dfbb3c",
  "worker_sha256": "b94f3089631b5a278c1fc688329b240ff0f6dc5517b26f98908144a8a55dbd10",
  "checker_sha256": "b94f3089631b5a278c1fc688329b240ff0f6dc5517b26f98908144a8a55dbd10",
  "evidence_sha256": [
    "994f979f31f559fc36d375d812e0ab15f4b3d00843d2fe61a2dde2e98482c72d",
    "994f979f31f559fc36d375d812e0ab15f4b3d00843d2fe61a2dde2e98482c72d"
  ],
  "repeatability": "verified",
  "result": {
    "kind": "violated",
    "assertion_ids": [
      "simultaneous-death-suppressed"
    ]
  }
}
